{
  "source_id": "huggingface-allbench",
  "snapshot_date": "2026-10-31",
  "source_url": "https://huggingface.co/spaces/open-llm-leaderboard/open_llm_leaderboard",
  "raw_notes": "直接实时抓取自 Hugging Face Open LLM Leaderboard v2 官方 Space 服务端（覆盖 4576 个最新开源大模型测评数据）。",
  "models": [
    {
      "rank": 1,
      "model_name": "MaziyarPanahi/calme-3.2-instruct-78b",
      "normalized_model_name": "maziyarpanahi-calme-3.2-instruct-78b",
      "organization": "MaziyarPanahi",
      "score": 52.08,
      "metrics": {
        "Average Score": 52.08,
        "IFEval": 80.63,
        "BBH": 62.61,
        "MATH L5": 40.33,
        "GPQA": 20.36,
        "MuSR": 38.53,
        "MMLU-PRO": 70.03
      },
      "notes": "架构: Qwen2ForCausalLM, 权重类型: Original, 精度: bfloat16"
    },
    {
      "rank": 2,
      "model_name": "MaziyarPanahi/calme-3.1-instruct-78b",
      "normalized_model_name": "maziyarpanahi-calme-3.1-instruct-78b",
      "organization": "MaziyarPanahi",
      "score": 51.29,
      "metrics": {
        "Average Score": 51.29,
        "IFEval": 81.36,
        "BBH": 62.41,
        "MATH L5": 39.27,
        "GPQA": 19.46,
        "MuSR": 36.5,
        "MMLU-PRO": 68.72
      },
      "notes": "架构: Qwen2ForCausalLM, 权重类型: Original, 精度: bfloat16"
    },
    {
      "rank": 3,
      "model_name": "dfurman/CalmeRys-78B-Orpo-v0.1",
      "normalized_model_name": "dfurman-calmerys-78b-orpo-v0.1",
      "organization": "dfurman",
      "score": 51.23,
      "metrics": {
        "Average Score": 51.23,
        "IFEval": 81.63,
        "BBH": 61.92,
        "MATH L5": 40.63,
        "GPQA": 20.02,
        "MuSR": 36.37,
        "MMLU-PRO": 66.8
      },
      "notes": "架构: Qwen2ForCausalLM, 权重类型: Original, 精度: bfloat16"
    },
    {
      "rank": 4,
      "model_name": "MaziyarPanahi/calme-2.4-rys-78b",
      "normalized_model_name": "maziyarpanahi-calme-2.4-rys-78b",
      "organization": "MaziyarPanahi",
      "score": 50.77,
      "metrics": {
        "Average Score": 50.77,
        "IFEval": 80.11,
        "BBH": 62.16,
        "MATH L5": 40.71,
        "GPQA": 20.36,
        "MuSR": 34.57,
        "MMLU-PRO": 66.69
      },
      "notes": "架构: Qwen2ForCausalLM, 权重类型: Original, 精度: bfloat16"
    },
    {
      "rank": 5,
      "model_name": "huihui-ai/Qwen2.5-72B-Instruct-abliterated",
      "normalized_model_name": "huihui-ai-qwen2.5-72b-instruct-abliterated",
      "organization": "huihui-ai",
      "score": 48.11,
      "metrics": {
        "Average Score": 48.11,
        "IFEval": 85.93,
        "BBH": 60.49,
        "MATH L5": 60.12,
        "GPQA": 19.35,
        "MuSR": 12.34,
        "MMLU-PRO": 50.41
      },
      "notes": "架构: Qwen2ForCausalLM, 权重类型: Original, 精度: bfloat16"
    },
    {
      "rank": 6,
      "model_name": "Qwen/Qwen2.5-72B-Instruct",
      "normalized_model_name": "qwen-qwen2.5-72b-instruct",
      "organization": "Qwen",
      "score": 47.98,
      "metrics": {
        "Average Score": 47.98,
        "IFEval": 86.38,
        "BBH": 61.87,
        "MATH L5": 59.82,
        "GPQA": 16.67,
        "MuSR": 11.74,
        "MMLU-PRO": 51.4
      },
      "notes": "架构: Qwen2ForCausalLM, 权重类型: Original, 精度: bfloat16"
    },
    {
      "rank": 7,
      "model_name": "MaziyarPanahi/calme-2.1-qwen2.5-72b",
      "normalized_model_name": "maziyarpanahi-calme-2.1-qwen2.5-72b",
      "organization": "MaziyarPanahi",
      "score": 47.86,
      "metrics": {
        "Average Score": 47.86,
        "IFEval": 86.62,
        "BBH": 61.66,
        "MATH L5": 59.14,
        "GPQA": 15.1,
        "MuSR": 13.3,
        "MMLU-PRO": 51.32
      },
      "notes": "架构: Qwen2ForCausalLM, 权重类型: Original, 精度: bfloat16"
    },
    {
      "rank": 8,
      "model_name": "newsbang/Homer-v1.0-Qwen2.5-72B",
      "normalized_model_name": "newsbang-homer-v1.0-qwen2.5-72b",
      "organization": "newsbang",
      "score": 47.46,
      "metrics": {
        "Average Score": 47.46,
        "IFEval": 76.28,
        "BBH": 62.27,
        "MATH L5": 49.02,
        "GPQA": 22.15,
        "MuSR": 17.9,
        "MMLU-PRO": 57.17
      },
      "notes": "架构: Qwen2ForCausalLM, 权重类型: Original, 精度: bfloat16"
    },
    {
      "rank": 9,
      "model_name": "ehristoforu/qwen2.5-test-32b-it",
      "normalized_model_name": "ehristoforu-qwen2.5-test-32b-it",
      "organization": "ehristoforu",
      "score": 47.37,
      "metrics": {
        "Average Score": 47.37,
        "IFEval": 78.89,
        "BBH": 58.28,
        "MATH L5": 59.74,
        "GPQA": 15.21,
        "MuSR": 19.13,
        "MMLU-PRO": 52.95
      },
      "notes": "架构: Qwen2ForCausalLM, 权重类型: Original, 精度: bfloat16"
    },
    {
      "rank": 10,
      "model_name": "Saxo/Linkbricks-Horizon-AI-Avengers-V1-32B",
      "normalized_model_name": "saxo-linkbricks-horizon-ai-avengers-v1-32b",
      "organization": "Saxo",
      "score": 47.34,
      "metrics": {
        "Average Score": 47.34,
        "IFEval": 79.72,
        "BBH": 57.63,
        "MATH L5": 60.27,
        "GPQA": 14.99,
        "MuSR": 18.16,
        "MMLU-PRO": 53.25
      },
      "notes": "架构: Qwen2ForCausalLM, 权重类型: Original, 精度: bfloat16"
    },
    {
      "rank": 11,
      "model_name": "MaziyarPanahi/calme-2.2-qwen2.5-72b",
      "normalized_model_name": "maziyarpanahi-calme-2.2-qwen2.5-72b",
      "organization": "MaziyarPanahi",
      "score": 47.22,
      "metrics": {
        "Average Score": 47.22,
        "IFEval": 84.77,
        "BBH": 61.8,
        "MATH L5": 58.91,
        "GPQA": 14.54,
        "MuSR": 12.02,
        "MMLU-PRO": 51.31
      },
      "notes": "架构: Qwen2ForCausalLM, 权重类型: Original, 精度: bfloat16"
    },
    {
      "rank": 12,
      "model_name": "fluently-lm/FluentlyLM-Prinum",
      "normalized_model_name": "fluently-lm-fluentlylm-prinum",
      "organization": "fluently-lm",
      "score": 47.22,
      "metrics": {
        "Average Score": 47.22,
        "IFEval": 80.9,
        "BBH": 59.48,
        "MATH L5": 54,
        "GPQA": 18.23,
        "MuSR": 17.26,
        "MMLU-PRO": 53.42
      },
      "notes": "架构: Qwen2ForCausalLM, 权重类型: Original, 精度: bfloat16"
    },
    {
      "rank": 13,
      "model_name": "JungZoona/T3Q-Qwen2.5-14B-Instruct-1M-e3",
      "normalized_model_name": "jungzoona-t3q-qwen2.5-14b-instruct-1m-e3",
      "organization": "JungZoona",
      "score": 47.09,
      "metrics": {
        "Average Score": 47.09,
        "IFEval": 73.24,
        "BBH": 65.47,
        "MATH L5": 28.63,
        "GPQA": 22.26,
        "MuSR": 38.69,
        "MMLU-PRO": 54.27
      },
      "notes": "架构: Unknown, 权重类型: Original, 精度: bfloat16"
    },
    {
      "rank": 14,
      "model_name": "JungZoona/T3Q-qwen2.5-14b-v1.0-e3",
      "normalized_model_name": "jungzoona-t3q-qwen2.5-14b-v1.0-e3",
      "organization": "JungZoona",
      "score": 47.09,
      "metrics": {
        "Average Score": 47.09,
        "IFEval": 73.24,
        "BBH": 65.47,
        "MATH L5": 28.63,
        "GPQA": 22.26,
        "MuSR": 38.69,
        "MMLU-PRO": 54.27
      },
      "notes": "架构: Qwen2ForCausalLM, 权重类型: Original, 精度: bfloat16"
    },
    {
      "rank": 15,
      "model_name": "zetasepic/Qwen2.5-32B-Instruct-abliterated-v2",
      "normalized_model_name": "zetasepic-qwen2.5-32b-instruct-abliterated-v2",
      "organization": "zetasepic",
      "score": 46.89,
      "metrics": {
        "Average Score": 46.89,
        "IFEval": 83.34,
        "BBH": 56.53,
        "MATH L5": 59.52,
        "GPQA": 15.66,
        "MuSR": 14.93,
        "MMLU-PRO": 51.35
      },
      "notes": "架构: Qwen2ForCausalLM, 权重类型: Original, 精度: bfloat16"
    }
  ]
}