{
  "source_id": "opencompass-overall",
  "snapshot_date": "2026-10-28",
  "source_url": "https://opencompass.org.cn/leaderboard-llm",
  "raw_notes": "通过 Playwright 无头浏览器模拟真实访问 OpenCompass 司南官方评测页面 (https://opencompass.org.cn/leaderboard-llm) 直取当前最新 DOM 表格数据（含知识、推理、数学、代码能力评分）。",
  "models": [
    {
      "rank": 1,
      "model_name": "Claude Opus 5 (high)",
      "normalized_model_name": "claude-opus-5-high",
      "organization": "Anthropic",
      "score": 83.3,
      "metrics": {
        "均分": 83.3,
        "知识": 94.1,
        "推理": 68.4,
        "数学": 77.3,
        "代码": 93.3,
        "发布日期": "2026/7/24"
      },
      "notes": "发布时间: 2026/7/24, 研发机构: Anthropic"
    },
    {
      "rank": 2,
      "model_name": "GPT-5.6-Sol (high)",
      "normalized_model_name": "gpt-5.6-sol-high",
      "organization": "OpenAI",
      "score": 80.8,
      "metrics": {
        "均分": 80.8,
        "知识": 88.5,
        "推理": 66.8,
        "数学": 71.4,
        "代码": 96.3,
        "发布日期": "2026/7/9"
      },
      "notes": "发布时间: 2026/7/9, 研发机构: OpenAI"
    },
    {
      "rank": 3,
      "model_name": "Qwen3.8-Max",
      "normalized_model_name": "qwen3.8-max",
      "organization": "Alibaba",
      "score": 80.6,
      "metrics": {
        "均分": 80.6,
        "知识": 86.8,
        "推理": 65.2,
        "数学": 75,
        "代码": 95.5,
        "发布日期": "2026/8/2"
      },
      "notes": "发布时间: 2026/8/2, 研发机构: Alibaba"
    },
    {
      "rank": 4,
      "model_name": "GPT-5.5 (high)",
      "normalized_model_name": "gpt-5.5-high",
      "organization": "OpenAI",
      "score": 80.6,
      "metrics": {
        "均分": 80.6,
        "知识": 87.7,
        "推理": 66.9,
        "数学": 71.4,
        "代码": 96.5,
        "发布日期": "2026/4/23"
      },
      "notes": "发布时间: 2026/4/23, 研发机构: OpenAI"
    },
    {
      "rank": 5,
      "model_name": "Gemini-3.7-Flash",
      "normalized_model_name": "gemini-3.7-flash",
      "organization": "Google",
      "score": 80.5,
      "metrics": {
        "均分": 80.5,
        "知识": 94,
        "推理": 62.1,
        "数学": 76.8,
        "代码": 89.3,
        "发布日期": "2026/8/13"
      },
      "notes": "发布时间: 2026/8/13, 研发机构: Google"
    },
    {
      "rank": 6,
      "model_name": "Doubao-Seed-2.1-Pro-260628 (high)",
      "normalized_model_name": "doubao-seed-2.1-pro-260628-high",
      "organization": "ByteDance",
      "score": 80.5,
      "metrics": {
        "均分": 80.5,
        "知识": 91.4,
        "推理": 64.9,
        "数学": 74.9,
        "代码": 90.8,
        "发布日期": "2026/6/28"
      },
      "notes": "发布时间: 2026/6/28, 研发机构: ByteDance"
    },
    {
      "rank": 7,
      "model_name": "Kimi-K3 (high)",
      "normalized_model_name": "kimi-k3-high",
      "organization": "Moonshot",
      "score": 79.1,
      "metrics": {
        "均分": 79.1,
        "知识": 90.3,
        "推理": 63.9,
        "数学": 74.1,
        "代码": 88,
        "发布日期": "2026/7/16"
      },
      "notes": "发布时间: 2026/7/16, 研发机构: Moonshot"
    },
    {
      "rank": 8,
      "model_name": "Grok-4.6 (high)",
      "normalized_model_name": "grok-4.6-high",
      "organization": "xAI",
      "score": 78,
      "metrics": {
        "均分": 78,
        "知识": 93.8,
        "推理": 60,
        "数学": 73,
        "代码": 85,
        "发布日期": "2026/8/12"
      },
      "notes": "发布时间: 2026/8/12, 研发机构: xAI"
    },
    {
      "rank": 9,
      "model_name": "DeepSeek-V4-Pro",
      "normalized_model_name": "deepseek-v4-pro",
      "organization": "DeepSeek",
      "score": 77.5,
      "metrics": {
        "均分": 77.5,
        "知识": 92.5,
        "推理": 55.5,
        "数学": 71.2,
        "代码": 91,
        "发布日期": "2026/4/24"
      },
      "notes": "发布时间: 2026/4/24, 研发机构: DeepSeek"
    },
    {
      "rank": 10,
      "model_name": "Kimi-K2.6 (high)",
      "normalized_model_name": "kimi-k2.6-high",
      "organization": "Moonshot",
      "score": 75.7,
      "metrics": {
        "均分": 75.7,
        "知识": 89.8,
        "推理": 62.9,
        "数学": 75.7,
        "代码": 74.5,
        "发布日期": "2026/4/20"
      },
      "notes": "发布时间: 2026/4/20, 研发机构: Moonshot"
    },
    {
      "rank": 11,
      "model_name": "Claude Opus 4.8 (high)",
      "normalized_model_name": "claude-opus-4.8-high",
      "organization": "Anthropic",
      "score": 75.1,
      "metrics": {
        "均分": 75.1,
        "知识": 87.5,
        "推理": 64.1,
        "数学": 71.5,
        "代码": 77.3,
        "发布日期": "2026/5/28"
      },
      "notes": "发布时间: 2026/5/28, 研发机构: Anthropic"
    },
    {
      "rank": 12,
      "model_name": "GLM-5.3",
      "normalized_model_name": "glm-5.3",
      "organization": "Zhipu AI",
      "score": 74.4,
      "metrics": {
        "均分": 74.4,
        "知识": 91.9,
        "推理": 62,
        "数学": 67.2,
        "代码": 76.5,
        "发布日期": "2026/8/14"
      },
      "notes": "发布时间: 2026/8/14, 研发机构: Zhipu AI"
    },
    {
      "rank": 13,
      "model_name": "DeepSeek-V4-Flash",
      "normalized_model_name": "deepseek-v4-flash",
      "organization": "DeepSeek",
      "score": 73.7,
      "metrics": {
        "均分": 73.7,
        "知识": 84.5,
        "推理": 61,
        "数学": 70.4,
        "代码": 79,
        "发布日期": "2026/4/24"
      },
      "notes": "发布时间: 2026/4/24, 研发机构: DeepSeek"
    },
    {
      "rank": 14,
      "model_name": "Hy3-preview (high)",
      "normalized_model_name": "hy3-preview-high",
      "organization": "Tencent",
      "score": 73.6,
      "metrics": {
        "均分": 73.6,
        "知识": 85.6,
        "推理": 54.6,
        "数学": 72.2,
        "代码": 82,
        "发布日期": "2026/4/23"
      },
      "notes": "发布时间: 2026/4/23, 研发机构: Tencent"
    },
    {
      "rank": 15,
      "model_name": "MiniMax-M3",
      "normalized_model_name": "minimax-m3",
      "organization": "MiniMax",
      "score": 69,
      "metrics": {
        "均分": 69,
        "知识": 86.6,
        "推理": 54,
        "数学": 63,
        "代码": 72.5,
        "发布日期": "2026/6/1"
      },
      "notes": "发布时间: 2026/6/1, 研发机构: MiniMax"
    }
  ]
}