{
  "source_id": "superclue-general",
  "snapshot_date": "2026-10-24",
  "source_url": "https://www.superclueai.com/",
  "raw_notes": "SuperCLUE 中文大模型综合测评快照，依据基础能力、专业能力与应用能力加权总分。",
  "models": [
    {
      "rank": 1,
      "model_name": "GPT-4o",
      "normalized_model_name": "gpt-4o",
      "organization": "OpenAI",
      "score": 83.2,
      "metrics": {
        "总分": 83.2,
        "基础能力": 84.5,
        "专业能力": 82.1,
        "应用能力": 83.0
      },
      "notes": "全球闭源模型领跑"
    },
    {
      "rank": 2,
      "model_name": "Claude-3.5-Sonnet",
      "normalized_model_name": "claude-3-5-sonnet",
      "organization": "Anthropic",
      "score": 82.6,
      "metrics": {
        "总分": 82.6,
        "基础能力": 83.2,
        "专业能力": 83.8,
        "应用能力": 80.8
      },
      "notes": "专业能力维度最高"
    },
    {
      "rank": 3,
      "model_name": "GLM-4-Plus",
      "normalized_model_name": "glm-4-plus",
      "organization": "Zhipu AI",
      "score": 80.8,
      "metrics": {
        "总分": 80.8,
        "基础能力": 81.5,
        "专业能力": 80.4,
        "应用能力": 80.5
      },
      "notes": "国内自研模型位列第一梯队"
    },
    {
      "rank": 4,
      "model_name": "Qwen2.5-72B",
      "normalized_model_name": "qwen2.5-72b-instruct",
      "organization": "Alibaba",
      "score": 80.5,
      "metrics": {
        "总分": 80.5,
        "基础能力": 81.2,
        "专业能力": 79.9,
        "应用能力": 80.4
      },
      "notes": "开源中文能力突出"
    },
    {
      "rank": 5,
      "model_name": "ERNIE 4.0 Turbo",
      "normalized_model_name": "ernie-4.0-turbo",
      "organization": "Baidu",
      "score": 79.9,
      "metrics": {
        "总分": 79.9,
        "基础能力": 80.4,
        "专业能力": 79.1,
        "应用能力": 80.2
      },
      "notes": "百度文心旗舰 Turbo 升级版"
    },
    {
      "rank": 6,
      "model_name": "Doubao-pro-128k",
      "normalized_model_name": "doubao-pro",
      "organization": "ByteDance",
      "score": 79.4,
      "metrics": {
        "总分": 79.4,
        "基础能力": 80.0,
        "专业能力": 78.5,
        "应用能力": 79.7
      },
      "notes": "长上下文与应用落地优异"
    }
  ]
}
